{
  "schema_version": "1.0.0",
  "package_version": "1.0.0",
  "target_framework": "VCGF",
  "target_framework_version": "1.3.0",
  "status": "final-integration-candidate",
  "activation_semantics": "explicit-interaction-signals-only; patterns-do-not-auto-activate-components-or-other-patterns",
  "patterns": [
    {
      "id": "VCGF-UI-INT-001",
      "pattern": "SmartCreateFlow",
      "title": "تدفق إنشاء السجل الذكي",
      "priority": "P0",
      "version": "0.4.0",
      "status": "final-integration-candidate",
      "path": "interactions/VCGF-UI-INT-001-SmartCreateFlow.md",
      "category": "record-lifecycle",
      "purpose": "تنظيم إنشاء سجل جديد من بدء الإدخال حتى نجاح الحفظ والانتقال التالي، مع منع الحالات المزدوجة أو السجلات الجزئية غير المقصودة.",
      "applies_when": "شاشات إنشاء السجلات والطلبات والمعاملات والكيانات التي تنشئ هوية أو أثرًا مستمرًا جديدًا.",
      "not_applicable_when": "لا ينطبق على فلاتر البحث أو النماذج المؤقتة التي لا تنشئ سجلًا ولا على الإجراءات عديمة الحالة.",
      "triggers": [
        "record_create",
        "new_entity_flow",
        "create_form",
        "new_request"
      ],
      "review_components": [
        "VCGF-UI-COMP-003",
        "VCGF-UI-COMP-008",
        "VCGF-UI-COMP-012",
        "VCGF-UI-COMP-023"
      ],
      "settings": [
        {
          "key": "postSuccessNavigation",
          "type": "string",
          "default": "detail",
          "scope": "system/tenant",
          "constraints": "detail أو list أو stay وفق المهمة؛ لا يفترض المسار دون عقد."
        },
        {
          "key": "initialStatePolicy",
          "type": "string",
          "default": "server-defaults",
          "scope": "system/tenant",
          "constraints": "مصدر القيم الافتراضية يجب أن يكون موثقًا ولا يطغى على قواعد المجال."
        },
        {
          "key": "revalidateAuthority",
          "type": "boolean",
          "default": true,
          "scope": "system/tenant",
          "constraints": "قبل أي أثر مستمر أو انتقال حساس تعاد مراجعة السلطة والصلاحية من المصدر الموثوق."
        },
        {
          "key": "preserveContextOnFailure",
          "type": "boolean",
          "default": true,
          "scope": "system/tenant",
          "constraints": "يحافظ على سياق المستخدم ومدخلاته المسموح بها عند الخطأ، دون تخزين أسرار."
        },
        {
          "key": "auditLevel",
          "type": "string",
          "default": "risk-based",
          "scope": "system/tenant",
          "constraints": "none أو minimal أو risk-based أو full حسب نوع الإجراء وسياسة التدقيق."
        },
        {
          "key": "telemetryMode",
          "type": "string",
          "default": "privacy-aware",
          "scope": "system/tenant",
          "constraints": "تقاس الحالات والأزمنة دون إرسال محتوى حساس أو معرفات غير لازمة."
        }
      ],
      "requirement_count": 12,
      "acceptance_count": 12
    },
    {
      "id": "VCGF-UI-INT-002",
      "pattern": "SmartEditFlow",
      "title": "تدفق تعديل السجل الذكي",
      "priority": "P0",
      "version": "0.4.0",
      "status": "final-integration-candidate",
      "path": "interactions/VCGF-UI-INT-002-SmartEditFlow.md",
      "category": "record-lifecycle",
      "purpose": "إدارة تعديل سجل قائم مع نسخة أساس معروفة، وحفظ آمن، وإعادة تحقق من الصلاحية والإصدار قبل اعتماد التغيير.",
      "applies_when": "شاشات تعديل السجلات أو التحرير المضمن الذي يغيّر بيانات مستمرة.",
      "not_applicable_when": "لا ينطبق على قراءة فقط أو تفضيلات عرض محلية لا تؤثر في بيانات الأعمال.",
      "triggers": [
        "record_edit",
        "edit_form",
        "inline_edit",
        "update_entity"
      ],
      "review_components": [
        "VCGF-UI-COMP-003",
        "VCGF-UI-COMP-025",
        "VCGF-UI-COMP-016",
        "VCGF-UI-COMP-023"
      ],
      "settings": [
        {
          "key": "editEntryMode",
          "type": "string",
          "default": "explicit",
          "scope": "system/tenant",
          "constraints": "explicit أو inline-controlled؛ لا تحول القراءة إلى تحرير دائم."
        },
        {
          "key": "refreshOnOpen",
          "type": "boolean",
          "default": true,
          "scope": "system/tenant",
          "constraints": "يُجلب أحدث إصدار مسموح قبل بدء التعديل ما لم يوجد سبب موثق."
        },
        {
          "key": "revalidateAuthority",
          "type": "boolean",
          "default": true,
          "scope": "system/tenant",
          "constraints": "قبل أي أثر مستمر أو انتقال حساس تعاد مراجعة السلطة والصلاحية من المصدر الموثوق."
        },
        {
          "key": "preserveContextOnFailure",
          "type": "boolean",
          "default": true,
          "scope": "system/tenant",
          "constraints": "يحافظ على سياق المستخدم ومدخلاته المسموح بها عند الخطأ، دون تخزين أسرار."
        },
        {
          "key": "auditLevel",
          "type": "string",
          "default": "risk-based",
          "scope": "system/tenant",
          "constraints": "none أو minimal أو risk-based أو full حسب نوع الإجراء وسياسة التدقيق."
        },
        {
          "key": "telemetryMode",
          "type": "string",
          "default": "privacy-aware",
          "scope": "system/tenant",
          "constraints": "تقاس الحالات والأزمنة دون إرسال محتوى حساس أو معرفات غير لازمة."
        }
      ],
      "requirement_count": 12,
      "acceptance_count": 12
    },
    {
      "id": "VCGF-UI-INT-003",
      "pattern": "SmartViewRefreshFlow",
      "title": "عرض السجل والتحديث والبيانات القديمة",
      "priority": "P1",
      "version": "0.4.0",
      "status": "final-integration-candidate",
      "path": "interactions/VCGF-UI-INT-003-SmartViewRefreshFlow.md",
      "category": "record-lifecycle",
      "purpose": "تحديد كيفية عرض بيانات القراءة، كشف قدمها، تحديثها، والحفاظ على سياق المستخدم عندما تصل نسخة أحدث.",
      "applies_when": "صفحات التفاصيل ولوحات القراءة والقوائم التي قد تبقى مفتوحة بينما تتغير البيانات من مصدر آخر.",
      "not_applicable_when": "لا ينطبق على محتوى ثابت أو بيانات لا تتغير أثناء الجلسة وفق عقد موثق.",
      "triggers": [
        "view_record",
        "read_only_view",
        "stale_data_possible",
        "refreshable_detail"
      ],
      "review_components": [
        "VCGF-UI-COMP-025",
        "VCGF-UI-COMP-002",
        "VCGF-UI-COMP-008"
      ],
      "settings": [
        {
          "key": "staleDataPolicy",
          "type": "string",
          "default": "signal",
          "scope": "system/tenant",
          "constraints": "signal أو refresh أو block حسب حساسية القرار."
        },
        {
          "key": "autoRefresh",
          "type": "string",
          "default": "measured",
          "scope": "system/tenant",
          "constraints": "off أو measured أو realtime وفق طبيعة البيانات والعبء."
        },
        {
          "key": "revalidateAuthority",
          "type": "boolean",
          "default": true,
          "scope": "system/tenant",
          "constraints": "قبل أي أثر مستمر أو انتقال حساس تعاد مراجعة السلطة والصلاحية من المصدر الموثوق."
        },
        {
          "key": "preserveContextOnFailure",
          "type": "boolean",
          "default": true,
          "scope": "system/tenant",
          "constraints": "يحافظ على سياق المستخدم ومدخلاته المسموح بها عند الخطأ، دون تخزين أسرار."
        },
        {
          "key": "auditLevel",
          "type": "string",
          "default": "risk-based",
          "scope": "system/tenant",
          "constraints": "none أو minimal أو risk-based أو full حسب نوع الإجراء وسياسة التدقيق."
        },
        {
          "key": "telemetryMode",
          "type": "string",
          "default": "privacy-aware",
          "scope": "system/tenant",
          "constraints": "تقاس الحالات والأزمنة دون إرسال محتوى حساس أو معرفات غير لازمة."
        }
      ],
      "requirement_count": 12,
      "acceptance_count": 12
    },
    {
      "id": "VCGF-UI-INT-004",
      "pattern": "SafeDeleteFlow",
      "title": "تدفق الحذف الآمن",
      "priority": "P0",
      "version": "0.4.0",
      "status": "final-integration-candidate",
      "path": "interactions/VCGF-UI-INT-004-SafeDeleteFlow.md",
      "category": "destructive-actions",
      "purpose": "حماية عمليات الحذف أو الإزالة ذات الأثر من التنفيذ العرضي أو غير المصرح، مع توضيح النطاق وقابلية الاسترجاع.",
      "applies_when": "الحذف النهائي، الإلغاء، إزالة العلاقات، الأرشفة غير القابلة للعكس أو أي إجراء تدميري مماثل.",
      "not_applicable_when": "لا يطبق على إخفاء بصري محلي أو إزالة اختيار لم يُحفظ.",
      "triggers": [
        "delete_record",
        "destructive_action",
        "archive_irreversible",
        "remove_relation"
      ],
      "review_components": [
        "VCGF-UI-COMP-012",
        "VCGF-UI-COMP-031",
        "VCGF-UI-COMP-008",
        "VCGF-UI-COMP-016"
      ],
      "settings": [
        {
          "key": "deleteMode",
          "type": "string",
          "default": "domain-defined",
          "scope": "system/tenant",
          "constraints": "soft أو hard أو archive حسب المجال؛ الواجهة لا تختاره وحدها."
        },
        {
          "key": "reasonPolicy",
          "type": "string",
          "default": "risk-based",
          "scope": "system/tenant",
          "constraints": "none أو optional أو required وفق تصنيف الإجراء."
        },
        {
          "key": "revalidateAuthority",
          "type": "boolean",
          "default": true,
          "scope": "system/tenant",
          "constraints": "قبل أي أثر مستمر أو انتقال حساس تعاد مراجعة السلطة والصلاحية من المصدر الموثوق."
        },
        {
          "key": "preserveContextOnFailure",
          "type": "boolean",
          "default": true,
          "scope": "system/tenant",
          "constraints": "يحافظ على سياق المستخدم ومدخلاته المسموح بها عند الخطأ، دون تخزين أسرار."
        },
        {
          "key": "auditLevel",
          "type": "string",
          "default": "risk-based",
          "scope": "system/tenant",